{
  "$schema": "https://json-schema.org/draft/2020-12/schema",
  "$id": "https://github.com/sidebutton/agent-runners/blob/main/profiles.schema.json",
  "title": "Agent runners profiles manifest",
  "description": "Product-level profile templates the portal Create-Agent wizard offers. A profile is a named PRESET of components (components.json) on top of the single base runner, plus default roles. The wizard pre-checks the preset's components; the user may uncheck or add any component. The portal vendors this file; agent-runners is the single source of truth.",
  "type": "object",
  "required": ["version", "default", "order", "profiles"],
  "properties": {
    "$schema": { "type": "string" },
    "version": { "type": "integer", "minimum": 1 },
    "default": {
      "type": "string",
      "description": "Default profile slug pre-selected in the wizard. MUST be one of profiles[].slug."
    },
    "order": {
      "type": "array",
      "items": { "type": "string" },
      "description": "Dropdown order. MUST list every profiles[].slug exactly once."
    },
    "runner": {
      "type": "string",
      "description": "The single base runner variant all profiles install onto (ubuntu-claude-code). Profiles differ by components, not runner."
    },
    "aliases": {
      "type": "object",
      "additionalProperties": { "type": "string" },
      "description": "Legacy slug → canonical slug (e.g. 'qa-generalist' → 'swe-full-stack'). Reserved for a future rename: DECLARED HERE BUT CONSUMED NOWHERE today — the portal's canonicalProfileSlug only trims, so a dropped slug does not fall back. Keep it {} unless alias machinery ships with it."
    },
    "profiles": {
      "type": "array",
      "minItems": 1,
      "items": { "$ref": "#/$defs/profile" }
    }
  },
  "$defs": {
    "profile": {
      "type": "object",
      "required": ["slug", "name", "description", "runner", "default_roles", "components"],
      "properties": {
        "slug": { "type": "string", "pattern": "^[a-z0-9][a-z0-9-]*$", "description": "Stable id persisted in agents.profile." },
        "name": { "type": "string", "description": "Template name shown in the wizard dropdown + consolidated profile block." },
        "description": { "type": "string", "description": "One-line stack description (helper text + row sub-line)." },
        "runner": { "type": "string", "description": "Base runner variant this profile installs onto (always ubuntu-claude-code)." },
        "default_roles": {
          "type": "array",
          "items": { "type": "string" },
          "description": "Roles seeded into agents.capabilities when the wizard omits an explicit roles[] override AND the component set includes sidebutton-server. Without the server the agent has capabilities=[] (not dispatchable)."
        },
        "components": {
          "type": "array",
          "items": { "type": "string" },
          "description": "Infra component slugs (components.json) pre-checked in the wizard for this profile. The user may uncheck or add any component before provisioning; the final set is threaded as AGENT_COMPONENTS. Plugins are NOT components — they are a separate role-driven catalog (plugins.json) selected in wizard Step 2 and sent as SIDEBUTTON_PLUGINS."
        },
        "locked": {
          "type": "array",
          "items": { "type": "string" },
          "description": "Component slugs this profile PINS: pre-checked like the rest of components[] but not un-checkable in the wizard — unticking one would make the profile something other than what its name promises (e.g. SWE Full Stack without the Chrome extension). Every entry MUST also appear in this profile's own components[]. Absent → nothing is locked; the whole preset stays editable. Globally-required components (components.json `required`) are a separate, catalog-wide mechanism."
        }
      },
      "additionalProperties": false
    }
  }
}
