{
  "$schema": "./profiles.schema.json",
  "version": 3,
  "default": "swe-full-stack",
  "order": ["swe-full-stack", "swe-dotnet", "swe-android", "app-builder"],
  "runner": "ubuntu-claude-code",
  "aliases": {},
  "profiles": [
    {
      "slug": "swe-full-stack",
      "name": "SideButton SWE Full Stack",
      "description": "SideButton MCP server + Chrome extension + knowledge packs.",
      "runner": "ubuntu-claude-code",
      "default_roles": ["se", "qa", "sd", "pm"],
      "components": ["claude-code", "chrome", "sidebutton-server", "sidebutton-extension", "knowledge-packs"],
      "locked": ["sidebutton-extension"]
    },
    {
      "slug": "swe-dotnet",
      "name": "SideButton SWE .NET",
      "description": "SWE Full Stack + the .NET 9 SDK. Add Docker + Postgres client for the full test stack.",
      "runner": "ubuntu-claude-code",
      "default_roles": ["se", "qa", "sd", "pm"],
      "components": ["claude-code", "chrome", "sidebutton-server", "sidebutton-extension", "knowledge-packs", "dotnet9"],
      "locked": ["sidebutton-extension"]
    },
    {
      "slug": "swe-android",
      "name": "SideButton SWE Android",
      "description": "SWE Full Stack + JDK 17, the Android SDK, and the Android Emulator (headless AVD for on-device UI discovery/testing, booted on demand via sb-avd-start; needs KVM). The Create-Agent wizard enforces a KVM-capable machine where the provider offers one (AWS XL/m8i class); on Hetzner none qualifies and discovery falls back to source-only.",
      "runner": "ubuntu-claude-code",
      "default_roles": ["se", "qa", "sd", "pm"],
      "components": ["claude-code", "chrome", "sidebutton-server", "sidebutton-extension", "knowledge-packs", "android-sdk", "android-emulator"]
    },
    {
      "slug": "app-builder",
      "name": "SideButton App Agent",
      "description": "SWE Full Stack + held editing sessions: runs the project's dev server for live preview, posts a ready-state screenshot, autosaves and republishes staged snapshots on every turn.",
      "runner": "ubuntu-claude-code",
      "default_roles": ["se", "qa", "pm"],
      "components": ["claude-code", "chrome", "sidebutton-server", "knowledge-packs"]
    }
  ]
}
